"Date","Record Number","Record Type","Address","Description","Permit Name","Status","Short Notes",
"06/21/2016","BA-201604515","Arborist Illegal Activity","1350 MERIDIAN ST SE, ATLANTA GA 30317","Illegal Tree Removal:    Golden Alliance, LLC        Operations Director:  Waqar Muhammad ParwaniMultiple trees removed from site without tree removal permit.1.) Sweetgum, 26"" dbh, located back leftside of property.2) Sweetgum, 25"" dbh, located back left of property.3.) Unknown, 30"" dbh, located back center left of property.4.) Water Oak, 28"" dbh, located leftside of property.5.) Red Oak, 33"" dbh, located front left of property.6.) Sweetgum, 34"" dbh, located front left center of property.7.) Unknown, 18"" dbh, located rightside of property.8.) Hackberry, 10"" dbh, located far back center of property.","Illegal Tree Removal","Assigned",,
"06/16/2016","BA-201604410","Arborist Illegal Activity","1191 HOSEA L WILLIAMS DR SE, ATLANTA GA 30317","INVESTIGATION ILLEGAL TREE IMPACT/ DESTRUCTION","INVESTIGATION","Assigned",,
"06/13/2016","BA-201604294","Arborist Illegal Activity","985 DREWRY ST NE, ATLANTA GA 30306","Illegal destruction of three trees at the rear of the property. 10"" Sweetgum13"" Hackberry18"" HackberryRoot zone damage is beyond prescriptive measures. Structural root plate damage on all three.","Illegal Activity","Fine",,
"06/08/2016","BA-201604195","Arborist Illegal Activity","2404 HANOVER WEST LN NW, ATLANTA GA 30327","Illegal destruction of the following trees by constructionFront yard trees destroyed:23"" Water Oak17"" Sweetgum9"" + 9"" Saucer MagnoliaRear yard trees destroyed20"" Water Oak13"" Loblolly Pine17"" Loblolly Pine15"" Loblolly Pine16"" Hackberry27"" Water Oak","ILLEGAL TREE DESTRUCTION","Open",,
"06/08/2016","BA-201604199","Arborist Illegal Activity","5005 GUILFORD FOREST DR SW, ATLANTA GA 30331","Investigation","Investigation","Assigned",,
"06/06/2016","BA-201604131","Arborist Illegal Activity","161 BLACKLAND RD NW, ATLANTA GA 30342","Illegal destruction of structural root plate and critical root zone of 40"" DBH Southern Red Oak and removal of double trunk 14"" + 20"" DBH Southern Magnolia","Illegal Activity","Assigned",,
"06/01/2016","BA-201604009","Arborist Illegal Activity","971 DEAN DR NW, ATLANTA GA 30318","ILLEGAL REMOVAL OF TWO TREES","ILLEGAL TREE REMOVAL","Assigned",,
"06/01/2016","BA-201604010","Arborist Illegal Activity","161 BLACKLAND RD NW, ATLANTA GA 30342","ILLEGAL REMOVAL OF ONE TREE","ILLEGAL TREE REMOVAL","Assigned",,
"06/01/2016","BA-201604012","Arborist Illegal Activity","2404 HANOVER WEST LN NW, ATLANTA GA 30327","ILLEGAL TREE REMOVAL OF FOUR TREES","ILLEGAL TREE REMOVAL","Assigned",,
"05/20/2016","BA-201603737","Arborist Illegal Activity","1146 EAST CONFEDERATE AVE SE, ATLANTA GA 30316","Illegal Tree Removal:1.) Red Oak, 30"" dbh, located front left of property.2.) Unknown, 7"" dbh, located back right of property.3.) Cherry, 14"" dbh, located back center/right of property.4.) Persimmon, 9"" dbh, located back center/left of property.5.) Unknown, 16"" dbh, located back left of property.Trees removed from site without Approved Tree Removal Permit.Tree Removal Company: Mr. Cecil McCrary, Metro Tree and Excavation,                                          1017 Woodward Circle SW, Mableton, GA 30126","Illegal Tree Removal","Assigned",,
"05/12/2016","BA-201603462","Arborist Illegal Activity","2657 LENOX RD NE, ATLANTA GA 0",,"Complaint","Pending - Illegal Activity",,
"05/12/2016","BA-201603481","Arborist Illegal Activity","949 ORMEWOOD TER SE, ATLANTA GA 30316","Illegal Tree Removal: 949 Ormewood Terrace SETree Service: Santa Maria Tree Service, 1982 Night Circle, Loganville, GA 300521.) Red Oak, 36"" dbh - stump, located back right corner of property - beside garage.2.) Water Oak, 30"" dbh, located back yard of property.3.) Dogwood, 11"" dbh, located front right of property.Tree(s) removed without approved tree removal permit.","Illegal Tree Removal","Assigned",,
"05/11/2016","BA-201603415","Arborist Illegal Activity","2695 LENOX RD NE, ATLANTA GA 30324","Illegal Removal of five trees near the front right corner of the property. 24"" Pine10"" Hardwood8""   Hardwood26"" Pine7""   Hardwood","Illegal Activity","Fine",,
"05/06/2016","BA-201603289","Arborist Illegal Activity","2695 LENOX RD NE, ATLANTA GA 30324","PLEASE INVESTIGATE THIS MATTER","INVESTIGATION","Fine",,
"05/03/2016","BA-201603192","Arborist Illegal Activity","252 BEVERLY RD NE, ATLANTA GA 30309","Illegal destruction/removal of three trees at the front of the property. 24"" Sycamore20"" Magnolia21"" Pine","Illegal Activity","Assigned",,
"04/04/2016","BA-201602227","Arborist Illegal Activity","3541 ROXBORO RD NE, ATLANTA GA 30326","Illegal removal of a tree of unknown diameter in the rear of the property.","Illegal Activity","Fine",,
"04/04/2016","BA-201602229","Arborist Illegal Activity","882 PONCE DE LEON AVE NE, ATLANTA GA 30306","Illegal removal of an oak of unknown diameter at the rear left of the building.","Illegal Activity","Fine",,
"03/29/2016","BA-201602042","Arborist Illegal Activity","612 FORTUNE PL NE, ATLANTA GA 30312","Illegal removal (2) trees along western P.L.","Illegal Destruction","Fine",,
"03/18/2016","BA-201601804","Arborist Illegal Activity","4115 GLEN DEVON DR NW, ATLANTA GA 30327","Illegal removal of trees on site. Pines. Locations on property are unknown.","Illegal Activity","Assigned",,
"03/18/2016","BA-201601824","Arborist Illegal Activity","633 TIMM VALLEY RD NE, ATLANTA GA 30305","Illegal destruction of a 30"" Tulip Poplar at the rear left property line.","Illegal Activity","Fine",,
"03/17/2016","BA-201601800","Arborist Illegal Activity","1141 ANGELO CT NE, ATLANTA GA 30319","Illegal removal of three trees totaling 63 inches in diameter. 25"" Oak at front right. 20"" Magnolia at rear left. 18"" Oak at rear left.","Illegal Activity","Fine",,
"03/09/2016","BA-201601507","Arborist Illegal Activity","172 SECOND AVE SE, ATLANTA GA 00000","Illegal Tree Removal:1.) Water Oak, 29"" dbh, located leftside of property.Tree removed without approved tree removal permit.","Illegal Tree Removal","Assigned",,
"03/09/2016","BA-201601520","Arborist Illegal Activity","1670 JOHNSON RD NE, ATLANTA GA 30306","Illegal removal of 3 front yard trees.32"" Pine32"" Pine24"" Magnolia","Illegal Activity","Fine",,
"03/08/2016","BA-201601458","Arborist Illegal Activity","1227 LANIER BLVD NE, ATLANTA GA 30306","Illegal destruction of a 24"" Tulip Poplar on the right side of the property and a 14"" River Birch at the front of the property.","Illegal Activity","Fine",,
"03/07/2016","BA-201601414","Arborist Illegal Activity","3620 KNOLLWOOD DR NW, ATLANTA GA 30305",,"site complaint","Pending - Illegal Activity",,
"03/04/2016","BA-201601399","Arborist Illegal Activity","500 NORTHSIDE CIR NW, ATLANTA GA 00000","Illegal removal of 3 hardwoods on the left side of the leasing office. Diameters unknown.","Illegal Activity","Fine",,
"03/02/2016","BA-201601333","Arborist Illegal Activity","949 PEACHTREE BATTLE AVE NW, ATLANTA GA 30327","Removal of 28"" hardwood shown on 2 surveys, revisions  and revised site plan.","illegal activity","Assigned",,
"02/26/2016","BA-201601207","Arborist Illegal Activity","523 ROCK SPRINGS RD NE, ATLANTA GA 30324","Illegal destruction of a 36"" White Oak at the rear left of the property.","Illegal Activity","Fine",,
"02/19/2016","BA-201601068","Arborist Illegal Activity","1780 MERTON RD NE, ATLANTA GA 30306","ComplaintThere maybe an illegal removal of (9) trees from the front of the yard at the property located at 1780 Merton Road,  Please investigate this matter.","Complaint","Closed - No Violation Found",,
"02/17/2016","BA-201600991","Arborist Illegal Activity","765 HARRISON PL SE, C, ATLANTA GA 30315","Illegal Tree Activity:1.) Pine, 25"" dbh, located back left corner of Lot 9-C, Impact Critical Root Zone. Orange X on tree.2.) Water Oak, 10"" dbh, located back left corner of Lot 9-C, Impact Critical Root Zone. Orange X on tree.3.) Post Oak, 28"" dbh, located back right corner of Lot 9-C, Impact Critical Root Zone. Orange X on tree.Trees impacted due to construction/digging/heavy equipment. No tree protection fence.","Illegal Tree Activity","Assigned",,
"02/10/2016","BA-201600806","Arborist Illegal Activity","731 STOVALL BLVD NE, ATLANTA GA 30342","Illegal Removal of three trees in the rear of the property:57"" Tulip Poplar14"" Pine12"" Pine","Illegal Activity","Fine",,
"02/10/2016","BA-201600809","Arborist Illegal Activity","1210 HOSEA L WILLIAMS DR NE, ATLANTA GA 30317","Illegal Removal of three unknown hardwoods at the rear left side.","Illegal Activity","Fine",,
"02/10/2016","BA-201600813","Arborist Illegal Activity","140 LAKE FORREST LN NE, ATLANTA GA 30342","Three trees were illegally destroyed via topping. All three trees are located at the front of the property. 26"" Beech23"" Beech23"" Beech","Illegal Activity","Fine",,
"02/05/2016","BA-201600697","Arborist Illegal Activity","1444 MCPHERSON AVE SE, ATLANTA GA 30316","Tree Company: Hernandez Tree Service      2833 E Mount Tabor Cir Duluth, Georgia 30096Illegal Tree Removal:1.) Red Oak, 35"" dbh, located back center of property.2.) Unknown, unknown dbh, located back left corner of property.3.) Water Oak, unknown dbh, located front leftside of property.4.) Unknown, unknown dbh, located front left corner of property.Trees removed without approved tree removal permit.","Illegal Tree Removal","Assigned",,
"02/01/2016","BA-201600546","Arborist Illegal Activity","788 GREENWOOD AVE NE, ATLANTA GA 30306",,"site complaint","Pending - Illegal Activity",,
"01/29/2016","BA-201600501","Arborist Illegal Activity","2796 MARGARET MITCHELL DR NW, ATLANTA GA 30327",,"Complaint","Assigned",,
"01/29/2016","BA-201600515","Arborist Illegal Activity","2648 KNOX ST NE, ATLANTA GA 30317","Illegal removal of two trees before the posting process was completed. 28"" Oak32"" Poplar","Illegal Activity","Fine",,
"01/29/2016","BA-201600517","Arborist Illegal Activity","2893 ANDREWS DR NW, ATLANTA GA 30305",,"site investigation","Assigned",,
"01/29/2016","BA-201600521","Arborist Illegal Activity","2899 ANDREWS DR NW, ATLANTA GA 30305",,"site investigation","Assigned",,
"01/22/2016","BA-201600366","Arborist Illegal Activity","643 CLIFTON RD NE, ATLANTA GA 30307","Illegal destruction of an 18"" Oak at the front right of the property.","Illegal Activity","Fine",,
"01/15/2016","BA-201600262","Arborist Illegal Activity","2084 DEKALB AVE NE, ATLANTA GA 30307","Illegal Tree Activity:1.) Water Oak, 18"" dbh, located front left of property.2.) Water Oak, 19"" dbh, located front right of property.3.) Dogwood, 12"" dbh, located front right of property.Dogwood removed without tree removal permit; Water Oaks impacted during construction.","Illegal Tree Activity","Issued",,
"01/14/2016","BA-201600243","Arborist Illegal Activity","292 GORDON AVE NE, ATLANTA GA 30307","Illegal Tree Removal:1.) Unknown, 12"" dbh, located center of lot.2.) Unknown, 12"" dbh, located front center of lot.Tree removed without approved tree removal permit.","Illegal Tree Removal","Issued",,
"01/13/2016","BA-201600213","Arborist Illegal Activity","2783 GRAND AVE SW, ATLANTA GA 30315","Illegal Tree Removal:1.) Pine, 14"" dbh, located back left of property.2.) Magnolia, 15"" dbh, located back center of property.Tree(s) removed without tree removal permit.","Illegal Tree Activity","Assigned",,
"12/22/2015","BA-201508374","Arborist Illegal Activity","657 CRESTHILL AVE NE, ATLANTA GA 30306","No tree protection fence","No tree protection fence","Closed",,
"12/15/2015","BA-201508206","Arborist Illegal Activity","2080 DEKALB AVE NE, ATLANTA GA 30307","Illegal Tree Activity:1.) Water Oak, 19"" dbh, located front left of property.2.) Water Oak, 20"" dbh, located front right of property.Critical root zone/structural roots severed due to construction and building retaining wall.","Illegal Tree Activity","Assigned",,
"12/14/2015","BA-201508188","Arborist Illegal Activity","174 THE PRADO NE, ATLANTA GA 30309","construction impact to 45 "" sycamore","tree impact","Fine",,
"12/08/2015","BA-201508052","Arborist Illegal Activity","1717 MONROE DR NE, ATLANTA GA 30324","Unpermitted removal of two pines in the rear yard. Diameters unknown.","Illegal Removal","Fine",,
"12/08/2015","BA-201508063","Arborist Illegal Activity","2801 MEMORIAL DR SE, ATLANTA GA 30317","Illegal Tree Activity:1.) Pine, 23"" dbh, located front left of property - approx. 2' ft. - 3' ft. alongside construction of sidewalk. Structural roots severed during construction.Issuing to construction manager, David Reed.","Illegal Tree Activity","Assigned",,
"12/08/2015","BA-201508064","Arborist Illegal Activity","2851 MEMORIAL DR SE, ATLANTA GA 30317","Illegal Tree Activity:1. ) Post Oak, 16"" dbh, located front center of property - approx. 2' ft. - 3' ft. alongside construction of sidewalk. Structural roots severed during construction.Issuing to construction manager, David Reed.","Illegal Tree Activity","Assigned",,
"11/13/2015","BA-201507512","Arborist Illegal Activity","70 MADDOX DR NE, ATLANTA GA 30309","Removal of at least one 14"" hardwood on right side in back yard.","Tree removal","Fine",,
"11/09/2015","BA-201507399","Arborist Illegal Activity","61 WEATHERBY ST SE, ATLANTA GA 30316","Illegal Tree Removal:1.) 6 trees located in the back of property removed without permit; trees were intended to be protected/saved per plans.Contractor: Regal Custom Homes, contact Stephen Russell at russ4221@gmail.com 770-231-9098","Illegal Tree Removal","Assigned",,
"10/13/2015","BA-201506748","Arborist Illegal Activity","145 NORWOOD AVE NE, ATLANTA GA 30317","Illegal Tree Removal:1.) Pecan, 17"" dbh, located back right of property. Tree removed without Orange X2.) Pecan, 18"" dbh, located back right of property. Tree removed without Orange X","Illegal Activity","Assigned",,
"10/09/2015","BA-201506629","Arborist Illegal Activity","724 OAKLAND AVE SE, ATLANTA GA 30315","Illegal Tree Removal:1.) Unknown, 9"" diameter at breast height, located back rightside of property.Tree removed from site without permit.","Illegal Tree Removal","Fine",,
"10/06/2015","BA-201506463","Arborist Illegal Activity","5 EAST LAKE DR NE, ATLANTA GA 30317","Illegal Tree Removal:1.) Water Oak, 14"" dbh, located back leftside of property.Tree removed without posting or permit.","Illegal Tree Removal","Assigned",,
"10/06/2015","BA-201506522","Arborist Illegal Activity","505 ETHEL ST NW, ATLANTA GA 30318","Illegal removal of trees in rear.","Illegal Removal","Closed - No Violation Found",,
"10/01/2015","BA-201506392","Arborist Illegal Activity","47 INTERLOCHEN DR NE, ATLANTA GA 30342","Illegal removal of 10 trees that total 133 diameter inches.","Illegal Activity","Fine",,
"09/30/2015","BA-201506353","Arborist Illegal Activity","811 BELGRADE AVE NE, ATLANTA GA 30306","Retaining wall built without permit. Check for tree impacts and removals.","investigation","Closed - No Violation Found",,
"09/29/2015","BA-201506312","Arborist Illegal Activity","1602 PEACHTREE BATTLE AVE NW, ATLANTA GA 30327",,"Complaint/Investigation","Pending - Illegal Activity",,
"09/29/2015","BA-201506313","Arborist Illegal Activity","1602 PEACHTREE BATTLE AVE NW, ATLANTA GA 30327","Illegal Activity","Illegal Activity","Open",,
"09/25/2015","BA-201506228","Arborist Illegal Activity","301 CENTRAL PARK PL NE, ATLANTA GA 30312","Illegal Tree Removal:1.) River Birch, 22"" dbh, located front center of Building 500.2.) Unknown, 28"" dbh, located back left of Biulding 500.3.) Water Oak, 65"" dbh, located front left of Building 800.Trees removed without approved tree removal permit.","Illegal Tree Removal","Closed - Illegal Activity",,
"09/14/2015","BA-201505870","Arborist Illegal Activity","225 MAYSON AVE NE, ATLANTA GA 30307","Illegal Tree Removal","Illegal Tree Removal","Assigned",,
"09/08/2015","BA-201505730","Arborist Illegal Activity","869 AMSTERDAM AVE NE, ATLANTA GA 30306",,"Complaint","Pending - Illegal Activity",,
"09/08/2015","BA-201505731","Arborist Illegal Activity","869 AMSTERDAM AVE NE, ATLANTA GA 30306","Illegal destruction of structural root plate on a 33"" White Oak located at the front left corner.","Illegal Activity","Assigned",,
"09/04/2015","BA-201505686","Arborist Illegal Activity","915 WOODLAND AVE SE, ATLANTA GA 30316","Illegal Tree Removal:1.) Pine, 37"" dbh, located far back right of property.2.) Pine, 19"" dbh, located far back center of property.3.) Cherry, 17"" dbh, located far back center of property.4.) Cherry, 11"" dbh, tree significantly damaged; appears during tree removal.","Illegal Tree Removal","Assigned",,
"09/04/2015","BA-201505689","Arborist Illegal Activity","268 PINELAND RD NW, ATLANTA GA 30342","illegal activity","illegal activity","Open",,
"09/04/2015","BA-201505694","Arborist Illegal Activity","4315 LAKEHAVEN DR NE, ATLANTA GA 30319","Illegal removal of:26"" Pine54"" Pine24"" Magnolia24"" Magnolia","Illegal Activity","Fine",,
"08/24/2015","BA-201505301","Arborist Illegal Activity","1811 LANGSTON AVE SW, ATLANTA GA 30310","Illegal Tree Removal:1.) Red Oak, 42"" diameter at breast height, located back center of property.Tree removed from property without approved tree removal permit.","Illegal Tree Removal","Assigned",,
"08/24/2015","BA-201505305","Arborist Illegal Activity","1125 NORTH SHORE DR SW, ATLANTA GA 30311","Illegal Tree Removal:1.) Magnolia, 11"" dbh, located front left of property.2.) Red Oak, 35"" dbh, located front leftside of property.Trees removed from property without approved tree removal permit.","Illegal Tree Removal:","Assigned",,
"08/19/2015","BA-201505156","Arborist Illegal Activity","3285 WEST ROXBORO RD NE, ATLANTA GA 30324","Illegal removal of: 19"" Magnolia at front left. 11"" Dogwood at front steps.","Illegal Activity","Fine",,
"08/12/2015","BA-201504952","Arborist Illegal Activity","2174 RANDO LN NW, ATLANTA GA 30318","Illegal RemovalThere  is  a concern in regards of a tree that was in the front yard of the property located at 2174 Rando Lane, SW, that was illegally removed on 8/11/15.  Please investigate this matter.  If you need pictures of the tree before and after they are available through the neighbor that witnessed the illegal activity.  You can contact Mr. Cargal for the pictures at 404 328-6068 9/1/15 - by K. Evans.   Homeowner provided signed contract/receipt from Metro Tree and Excavation showing that they took responsibility for obtaining all permits.  Per J. Rivera, Mr. Cecil McCrary of Metro Tree paid fine/fees on 9/10/15.","Illegal Removal","Assigned",,
"08/10/2015","BA-201504827","Arborist Illegal Activity","749 PONCE DE LEON TER NE, ATLANTA GA 00000","Illegal destruction of a 30"" Maple located at the front right of the property.","Illegal Activity","Fine",,
"08/05/2015","BA-201504702","Arborist Illegal Activity","3491 DALE LN SW, ATLANTA GA 30331","Illegal Activity/Removal:1.) Pine, 18"" dbh, located front right of property.2.) Pine, 17"" dbh, located front center of property.Trees removed without approval - tree permit; denied prior.","Illegal Activity/Removal","Assigned",,
"07/28/2015","BA-201504444","Arborist Illegal Activity","950 PROSPECT AVE SE, ATLANTA GA 30316","Illegal Activity/Tree Removal:1.) Tulip Poplar, 61"" (stump), located back leftside of property.Tree was removed from site without tree removal permit.","Illegal Activity/Tree Removal:","Assigned",,
"07/28/2015","BA-201504449","Arborist Illegal Activity","954 PROSPECT AVE SE, ATLANTA GA 30316","Illegal Activity/Tree Removal:1.)  White Oak, 59"" (stump), located front right of property.2.) Tulip Poplar, 50"" (stump), located rightside of property.3.) Tulip Poplar, 33"" (stump), located rightside of property.4.) Red Oak, 28"" (stump), located back right of property.Trees were removed from site without a tree removal permit.","Illegal Activity/Tree Removal:","Assigned",,
"07/24/2015","BA-201504346","Arborist Illegal Activity","442 HAROLD AVE NE, ATLANTA GA 30307","Illegal destruction of a 40"" White Oak critical root zone beyond the allowed limits. Tree is located at the front left.","Illegal Activity","Assigned",,
"07/22/2015","BA-201504324","Arborist Illegal Activity","1356 OAKCREST DR SW, ATLANTA GA 30311","Illegal Removal/Destruction:1.) Weeping Cherry, 35"" diameter at breast height, located front right of the property. Tree has multiple leads stemming from base; more than 20% of the canopy removed.","Illegal Removal/Destruction","Assigned",,
"07/13/2015","BA-201504099","Arborist Illegal Activity","1889 MOORES MILL RD NW, ATLANTA GA 30318","Removed two trees without permit","illegal tree removal","Open",,
"07/02/2015","BA-201503959","Arborist Illegal Activity","892 MARION AVE SE, ATLANTA GA 30312","Illegal Tree Removal:1.) Hardwood, 22"" dbh, located back leftside of property.Tree removed without permit.","Illegal Tree Removal","Assigned",,
"06/29/2015","BA-201503876","Arborist Illegal Activity","220 LAKEVIEW AVE NE, ATLANTA GA 30305","see if trees were illegally removed","site inspection","Open",,
"06/25/2015","BA-201503782","Arborist Illegal Activity","647 STOKESWOOD AVE SE, ATLANTA GA 30316","Illegal Tree Removal:1.) Sweetgum, 10"" dbh, located back right of property.2.) White Oak, 35"" dbh, located back left of property.3.) White Oak, 44"" dbh, located back right of property.4.) White Oak, 30"" dbh, located back left of property.","Illegal Tree Removal","Assigned",,
"06/19/2015","BA-201503622","Arborist Illegal Activity","350 EUREKA DR NE, ATLANTA GA 30305","Illegal Removal of a River Birch of unknown diameter.","Illegal Activity","Fine",,
"06/18/2015","BA-201503572","Arborist Illegal Activity","545 ELMWOOD RD NW, ATLANTA GA 30318","Illegal Tree Removal:1.) Water Oak, 10"" diameter at breast height, located rightside of residence.Tree removed without a permit.","Illegal Tree Removal","Assigned",,
"06/10/2015","BA-201503360","Arborist Illegal Activity","831 CLIFTON RD SE, ATLANTA GA 30316","Illegal Tree Removal","Illegal Tree Removal","Assigned",,
"06/03/2015","BA-201503174","Arborist Illegal Activity","480 BELL AVE SE, ATLANTA GA 00000","Illegal Removal:1.) Hardwood, 20"" diameter at breast height, located back left of property. Plans show tree as saved, tree removed without permit.","Illegal Removal","Assigned",,
"05/29/2015","BA-201503071","Arborist Illegal Activity","3433 LYNFIELD DR SW, ATLANTA GA 30311","Illegal Tree Removal:1.) Pine, 30"" diameter at breast height, located front center of property.Tree removed without approved tree removal permit.","Illegal Tree Removal","Assigned",,
"05/28/2015","BA-201503061","Arborist Illegal Activity","989 DREWRY ST NE, ATLANTA GA 30306","Illegal destruction of: 15"" Hackberry located a the rear left property line. Structural root plate damaged by construction.","Illegal Activity","Fine",,
"05/18/2015","BA-201502874","Arborist Illegal Activity","871 PENN AVE NE, ATLANTA GA 30309","Illegal removal of one tree located at the front right. Magnolia of unknown diameter.","Illegal Removal","Fine",,
"05/14/2015","BA-201502781","Arborist Illegal Activity","402 DECKNER AVE SW, ATLANTA GA 30310","Illegal Tree Removal1.) Red Oak, 35"" diameter at breast height, located front right of property.Tree removed without tree removal permit.Tree Company:   Capitol Tree Service, Charles Edge  P.O Box 1475, Red Oak, GA 30272","Illegal Tree Removal","Assigned",,
"05/12/2015","BA-201502652","Arborist Illegal Activity","2161 SPINK ST NW, ATLANTA GA 30318","illegal activity","illegal activity","Assigned",,
"05/11/2015","BA-201502651","Arborist Illegal Activity","2146 ABNER PL NW, ATLANTA GA 30318","ddh","ddh","Open",,
"04/29/2015","BA-201502413","Arborist Illegal Activity","3849 CLUB DR NE, ATLANTA GA 30319","Illegal Removal of a 24"" Pine at the rear right.","Illegal Activity","Assigned",,
"04/28/2015","BA-201502338","Arborist Illegal Activity","2032 HATTERAS WAY, ATLANTA GA 30318","Illegal RemovalThere is a concern that trees are being removed illegally on the property located at 2032 Hatters Way.  Please investigate this matter.","Illegal Removal","Assigned",,
"04/24/2015","BA-201502278","Arborist Illegal Activity","890 COURTENAY DR NE, ATLANTA GA 30306","Two trees removed without a permit.","Illegal Activity","Assigned",,
"04/23/2015","BA-201502221","Arborist Illegal Activity","600 VIRGINIA AVE NE, ATLANTA GA 30306","Illegal pruning of two trees within the front entrance area. Trees were topped and more than 20% of the living canopy was removed.","Illegal Activity","Assigned",,
"04/22/2015","BA-201502178","Arborist Illegal Activity","3318 EAST WOOD VALLEY RD NW, ATLANTA GA 30327","illegal removal","illegal removal","Assigned",,
"04/22/2015","BA-201502183","Arborist Illegal Activity","830 JOSEPH E LOWERY BLVD NW, ATLANTA GA 30318","illegal activity","illegal activity","Assigned",,
"04/22/2015","BA-201502200","Arborist Illegal Activity","1411 PEACHTREE BATTLE AVE NW, ATLANTA GA 30327","Illegal RemovalThere is a concern that there has been two illegal removals on this property.","Illegal Removal","Assigned",,
"04/21/2015","BA-201502159","Arborist Illegal Activity","2521 LAUREL CIR NW, ATLANTA GA 30311","Illegal Removal/Destruction:1. Maple, 9"" diameter at breast height, located front center of property.","Illegal Removal/Destruction","Assigned",,
"04/21/2015","BA-201502164","Arborist Illegal Activity","486 OLD WHEAT ST NE, ATLANTA GA 30312","Illegal Tree Removal/Destruction:1.) Hackberry, 16"" dbh, located back rightside of property.2.) Mulberry, 20"" dbh, located back rightside of property.3.) Hickory, 25"" dbh, located back rightside of property.","Illegal Tree Removal/Destruction","Assigned",,
"04/20/2015","BA-201502145","Arborist Illegal Activity","1217 BARNES ST NW, ATLANTA GA 30318","Illegal Removal","Illegal Removal","Closed - No Violation Found",,
